<?xml version="1.0" encoding="UTF-8"?>
<xsd:schema xmlns:xsd="http://www.w3.org/2001/XMLSchema" xmlns:od="urn:schemas-microsoft-com:officedata">
<xsd:element name="dataroot">
<xsd:complexType>
<xsd:sequence>
<xsd:element ref="lineage" minOccurs="0" maxOccurs="unbounded"/>
</xsd:sequence>
<xsd:attribute name="generated" type="xsd:dateTime"/>
</xsd:complexType>
</xsd:element>
<xsd:element name="lineage">
<xsd:annotation>
<xsd:appinfo>
<od:index index-name="bullyearpor" index-key="idbull yearreport pordaughter " primary="no" unique="yes" clustered="no"/>
<od:index index-name="PrimaryKey" index-key="id " primary="yes" unique="yes" clustered="no"/>
<od:index index-name="bulllineage" index-key="idbull " primary="no" unique="no" clustered="no"/>
</xsd:appinfo>
</xsd:annotation>
<xsd:complexType>
<xsd:sequence>
<xsd:element name="id" minOccurs="1" od:jetType="autonumber" od:sqlSType="int" od:autoUnique="yes" od:nonNullable="yes" type="xsd:int"/>
<xsd:element name="yearreport" minOccurs="0" od:jetType="text" od:sqlSType="nvarchar">
<xsd:simpleType>
<xsd:restriction base="xsd:string">
<xsd:maxLength value="10"/>
</xsd:restriction>
</xsd:simpleType>
</xsd:element>
<xsd:element name="idbull" minOccurs="0" od:jetType="longinteger" od:sqlSType="int" type="xsd:int"/>
<xsd:element name="sper" minOccurs="0" od:jetType="currency" od:sqlSType="money" type="xsd:double"/>
<xsd:element name="cena" minOccurs="0" od:jetType="currency" od:sqlSType="money" type="xsd:double"/>
<xsd:element name="kodkat" minOccurs="0" od:jetType="byte" od:sqlSType="tinyint" type="xsd:unsignedByte"/>
<xsd:element name="pordaughter" minOccurs="0" od:jetType="byte" od:sqlSType="tinyint" type="xsd:unsignedByte"/>
</xsd:sequence>
</xsd:complexType>
</xsd:element>
</xsd:schema>
